{
  "schema_version": 1,
  "harness": "grok",
  "source": "documented-only",
  "observed_at": null,
  "model": null,
  "reasoning_effort": null,
  "available_models": null,
  "available_reasoning_efforts": null,
  "available_model_effort_pairs": null,
  "model_override": false,
  "effort_override": false,
  "max_parallelism": null,
  "max_depth": null,
  "workspace_isolation": null,
  "resume": null,
  "hooks": [],
  "external_write_controls": []
}
